conversation_id_str,created_at,favorite_count,full_text,id_str,image_url,in_reply_to_screen_name,lang,location,quote_count,reply_count,retweet_count,tweet_url,user_id_str,username,text_clean_basic,text_stem,len_kata,kategori,is_turnover_related
1993289406833369439,Tue Nov 25 12:03:22 +0000 2025,0,ada yang pernah dapet tawaran kerja kayak gitu ngga? jdi kemarin aku apply kerja dengan role data entry lalu aku dapet email untuk konfirmasi sesi tanya jawab yang diarahkan ke wa. menurut kalian gimana? https://t.co/zyRFMHIHCK,1993289406833369439,https://pbs.twimg.com/media/G6mWJkza4AAFAl1.jpg,,in,,0,3,0,https://x.com/undefined/status/1993289406833369439,1562848528556498946,,ada yang pernah dapet tawaran kerja kayak gitu ngga jdi kemarin aku apply kerja dengan role data entry lalu aku dapet email untuk konfirmasi sesi tanya jawab yang diarahkan ke wa menurut kalian gimana,ada yang pernah dapet tawaran kerja kayak gitu ngga jdi kemarin aku apply kerja dengan role data entry lalu aku dapet email untuk konfirmasi sesi tanya jawab yang diarahkan ke wa menurut kalian gimana,38,peluang_baru,True
1993257161938391466,Tue Nov 25 10:41:17 +0000 2025,28,@tanyakanrl 3km deket itungannya nder kalo dirasa kuliahmu udah agak senggang ambil aja barangkali dari pelanggan kamu dapet rekomendasi atau tawaran kerja yang bagus,1993268749278003684,,tanyakanrl,in,,0,0,0,https://x.com/undefined/status/1993268749278003684,1303538138040553474,,km deket itungannya nder kalo dirasa kuliahmu udah agak senggang ambil aja barangkali dari pelanggan kamu dapet rekomendasi atau tawaran kerja yang bagus,km deket itungannya nder kalo dirasa kuliahmu udah agak senggang ambil aja barangkali dari pelanggan kamu dapet rekomendasi atau tawaran kerja yang bagus,24,peluang_baru,True
1993267873628946528,Tue Nov 25 10:37:48 +0000 2025,0,Proses dapet kerjaan ternyata menguji mental banget tiap hari bawaannya ya allah masyallah terus. Pas dikasih tawaran kerja malah ga diambil karena pertimbangan saat itu masih idealis banget. Padahal in this economy ga ada salahnya ambil aja sambil cari peluang lain + belajar,1993267873628946528,,,in,,0,0,0,https://x.com/undefined/status/1993267873628946528,1209779971549360128,,proses dapet kerjaan ternyata menguji mental banget tiap hari bawaannya ya allah masyallah terus pas dikasih tawaran kerja malah ga diambil karena pertimbangan saat itu masih idealis banget padahal in this economy ga ada salahnya ambil aja sambil cari peluang lain belajar,proses dapet kerjaan ternyata menguji mental banget tiap hari bawaannya ya allah masyallah terus pas dikasih tawaran kerja malah ga diambil karena pertimbangan saat itu masih idealis banget padahal in this economy ga ada salahnya ambil aja sambil cari peluang lain belajar,42,peluang_baru,True
1993258550437855585,Tue Nov 25 10:00:46 +0000 2025,1,Alhamdulillah masuk lg tawaran pindah kerja. Bismillah moga bsa ditempat baru ini. Walau letih nantinya bakalan nikmatin aja. Soalnya ini do'a yg dijabah.,1993258550437855585,,,in,,0,0,0,https://x.com/undefined/status/1993258550437855585,1264607030913798150,,alhamdulillah masuk lg tawaran pindah kerja bismillah moga bsa ditempat baru ini walau letih nantinya bakalan nikmatin aja soalnya ini do a yg dijabah,alhamdulillah masuk lg tawaran pindah kerja bismillah moga bsa ditempat baru ini walau letih nantinya bakalan nikmatin aja soalnya ini do a yg dijabah,24,peluang_baru,True
1993256750602944549,Tue Nov 25 09:53:36 +0000 2025,121,Mpun setelah semalam beristirahat di rumah saya alhamdulillah yang penting bisa kembali pulang dulu ke Kampung halaman setelah sebelumnya sempat terlunta-lunta karena ditipu tawaran kerja di Jogja. Nanti sesampainya di Brebes saya pantau untuk usaha yang mau dijalankannya. https://t.co/2jcT5kMTEa,1993256750602944549,https://pbs.twimg.com/amplify_video_thumb/1993256413469245441/img/_5w04CI1myBb79pQ.jpg,,in,,1,6,24,https://x.com/undefined/status/1993256750602944549,1687863021589467136,,mpun setelah semalam beristirahat di rumah saya alhamdulillah yang penting bisa kembali pulang dulu ke kampung halaman setelah sebelumnya sempat terlunta lunta karena ditipu tawaran kerja di jogja nanti sesampainya di brebes saya pantau untuk usaha yang mau dijalankannya,mpun setelah semalam beristirahat di rumah saya alhamdulillah yang penting bisa kembali pulang dulu ke kampung halaman setelah sebelumnya sempat terlunta lunta karena ditipu tawaran kerja di jogja nanti sesampainya di brebes saya pantau untuk usaha yang mau dijalankannya,43,peluang_baru,True
1993248685577367740,Tue Nov 25 09:21:34 +0000 2025,0,buka linkedin banyak banget tawaran (alhamdulillah) pindah kerja lagi apa? ngeliat tawarannya ada yang lebih menjanjikan.,1993248685577367740,,,in,,0,1,0,https://x.com/undefined/status/1993248685577367740,706110740931993600,,buka linkedin banyak banget tawaran alhamdulillah pindah kerja lagi apa ngeliat tawarannya ada yang lebih menjanjikan,buka linkedin banyak banget tawaran alhamdulillah pindah kerja lagi apa ngeliat tawarannya ada yang lebih menjanjikan,16,peluang_baru,True
1993248313936633860,Tue Nov 25 09:20:05 +0000 2025,2,-rek kalian ada ngga si yg belum sebulan kerja terus resign karena dapet tawaran yang lebih oke. Kalo pernah kalian izin resignya gimana? Dan pas interview ditempat baru kalian bilang juga kalo baru masuk kerja? Makasii,1993248313936633860,,,in,,0,2,0,https://x.com/undefined/status/1993248313936633860,1152437175587241985,,rek kalian ada ngga si yg belum sebulan kerja terus resign karena dapet tawaran yang lebih oke kalo pernah kalian izin resignya gimana dan pas interview ditempat baru kalian bilang juga kalo baru masuk kerja makasii,rek kalian ada ngga si yg belum sebulan kerja terus resign karena dapet tawaran yang lebih oke kalo pernah kalian izin resignya gimana dan pas interview ditempat baru kalian bilang juga kalo baru masuk kerja makasii,36,peluang_baru,True
1993245153780523104,Tue Nov 25 09:07:32 +0000 2025,0,dapet tawaran kerja sama produk kurma rasanya senangggg sekaliiii udah bau-bau ramadhan walopun aku blm ikut puasa (lagi) ,1993245153780523104,,,in,,0,0,0,https://x.com/undefined/status/1993245153780523104,1101148236704702465,,dapet tawaran kerja sama produk kurma rasanya senangggg sekaliiii udah bau bau ramadhan walopun aku blm ikut puasa lagi,dapet tawaran kerja sama produk kurma rasanya senangggg sekaliiii udah bau bau ramadhan walopun aku blm ikut puasa lagi,19,peluang_baru,True
1993218421799240066,Tue Nov 25 07:21:18 +0000 2025,0,tawaran kerja sama penulis yang lagi mau nerbitin buku dan butuh illustrator boleh hubungin aku ya kak nanti aku share porto,1993218421799240066,,,in,,0,0,0,https://x.com/undefined/status/1993218421799240066,1381507761008041985,,tawaran kerja sama penulis yang lagi mau nerbitin buku dan butuh illustrator boleh hubungin aku ya kak nanti aku share porto,tawaran kerja sama penulis yang lagi mau nerbitin buku dan butuh illustrator boleh hubungin aku ya kak nanti aku share porto,21,peluang_baru,True
1993160981883556039,Tue Nov 25 04:33:45 +0000 2025,1,@worksfess Bandingin sm yg lain aku jg di fase itu sih cuma kalo aku jarak antar tes dan announcenya lama bgt rekrutmen bs &gt;1 bln ini msh di tahap hr blm user dan ada tawaran kerja dr temen jd yaudah daripada ngarep ke yg gk pasti pdhl posisi di PT itu minatku bgt,1993176255483785640,,worksfess,in,,0,0,0,https://x.com/undefined/status/1993176255483785640,1023708138573156352,,bandingin sm yg lain aku jg di fase itu sih cuma kalo aku jarak antar tes dan announcenya lama bgt rekrutmen bs gt bln ini msh di tahap hr blm user dan ada tawaran kerja dr temen jd yaudah daripada ngarep ke yg gk pasti pdhl posisi di pt itu minatku bgt,bandingin sm yg lain aku jg di fase itu sih cuma kalo aku jarak antar tes dan announcenya lama bgt rekrutmen bs gt bln ini msh di tahap hr blm user dan ada tawaran kerja dr temen jd yaudah daripada ngarep ke yg gk pasti pdhl posisi di pt itu minatku bgt,54,peluang_baru,True
1993172737830064239,Tue Nov 25 04:19:46 +0000 2025,0,Ramalan Zodiak Hari Ini 25 November 2025 Cancer Siap Dapat Tawaran Kerja! https://t.co/XEvbwI3mHu,1993172737830064239,,,in,,0,0,0,https://x.com/undefined/status/1993172737830064239,1668147004491587585,,ramalan zodiak hari ini november cancer siap dapat tawaran kerja,ramalan zodiak hari ini november cancer siap dapat tawaran kerja,16,peluang_baru,True
1993137007535825269,Tue Nov 25 01:57:47 +0000 2025,0,Praying Circle: ️ 2026: Dapat tawaran kerja di luar negeri dengan gaji 10x lipat dari sekarang Content creation berhasil paid off all *****️,1993137007535825269,,,in,,0,0,0,https://x.com/undefined/status/1993137007535825269,1740560358476337152,,praying circle dapat tawaran kerja di luar negeri dengan gaji x lipat dari sekarang content creation berhasil paid off all,praying circle dapat tawaran kerja di luar negeri dengan gaji x lipat dari sekarang content creation berhasil paid off all,21,peluang_baru,True
1993087996170846508,Mon Nov 24 22:43:02 +0000 2025,0,Dakwaan berzina jejaskan kerjaya Inara Rusli mungkin hilang tawaran kerja... Banyak jenama mula bimbang #mstar251125 https://t.co/2nq4z2Zvjh,1993087996170846508,,,in,,0,0,0,https://x.com/undefined/status/1993087996170846508,28749269,,dakwaan berzina jejaskan kerjaya inara rusli mungkin hilang tawaran kerja banyak jenama mula bimbang,dakwaan berzina jejaskan kerjaya inara rusli mungkin hilang tawaran kerja banyak jenama mula bimbang,19,peluang_baru,True
1992957325934821651,Mon Nov 24 14:03:48 +0000 2025,0,guys tolong gue lagi bimbang bgt.. (1)fresh graduate lagi magang di perusahan gede but uang saku kecil but jenjang karir oke habis selsai febuari dapet tawaran kerja.. (2) daftar kemnaker gaji umr tapi cuma 6 bulan.. please better mana guys,1992957325934821651,,,in,,0,2,0,https://x.com/undefined/status/1992957325934821651,1210297386,,guys tolong gue lagi bimbang bgt fresh graduate lagi magang di perusahan gede but uang saku kecil but jenjang karir oke habis selsai febuari dapet tawaran kerja daftar kemnaker gaji umr tapi cuma bulan please better mana guys,guys tolong gue lagi bimbang bgt fresh graduate lagi magang di perusahan gede but uang saku kecil but jenjang karir oke habis selsai febuari dapet tawaran kerja daftar kemnaker gaji umr tapi cuma bulan please better mana guys,41,peluang_baru,True
1992928741140709583,Mon Nov 24 12:10:13 +0000 2025,2,Jadi w dapat tawaran kerja di warung es gtu gantiin adeknya 10 hari tapi dibayarnya tuh pas adeknya Dateng sehari 20k dari pagi sampe siang. Yang w pikirin gmana caranya bertahan hidup nunggu 10 hari itu. Sedangkan bapak tiri gak bisa diharepin. Stress banget pen bundir rasanya,1992928741140709583,,,in,,0,3,0,https://x.com/undefined/status/1992928741140709583,1898720769699680256,,jadi w dapat tawaran kerja di warung es gtu gantiin adeknya hari tapi dibayarnya tuh pas adeknya dateng sehari k dari pagi sampe siang yang w pikirin gmana caranya bertahan hidup nunggu hari itu sedangkan bapak tiri gak bisa diharepin stress banget pen bundir rasanya,jadi w dapat tawaran kerja di warung es gtu gantiin adeknya hari tapi dibayarnya tuh pas adeknya dateng sehari k dari pagi sampe siang yang w pikirin gmana caranya bertahan hidup nunggu hari itu sedangkan bapak tiri gak bisa diharepin stress banget pen bundir rasanya,47,peluang_baru,True
1992910476087583039,Mon Nov 24 10:57:38 +0000 2025,2,kalo punya value mah bebas bre. pasti cepet dapet kerja mirip kek tmen ane kaga sesuai standar dia/udah mentok dsb resign udah dapet tawaran dari perusahaan lain,1992910476087583039,,,in,,1,0,1,https://x.com/undefined/status/1992910476087583039,451958586,,kalo punya value mah bebas bre pasti cepet dapet kerja mirip kek tmen ane kaga sesuai standar dia udah mentok dsb resign udah dapet tawaran dari perusahaan lain,kalo punya value mah bebas bre pasti cepet dapet kerja mirip kek tmen ane kaga sesuai standar dia udah mentok dsb resign udah dapet tawaran dari perusahaan lain,28,peluang_baru,True
1992907439931531554,Mon Nov 24 10:45:37 +0000 2025,1,- Gadai ilegal - Penipuan berkedok tawaran kerja/brushing scam - Skema ponzi multi-level marketing (MLM) ilegal dll. Mereka juga melakukan pemblokiran ribuan situs/web/app nomor rekening nomor HP/WhatsApp penagih hingga menindak penagihan teror yang melanggar hukum.,1992907449901502740,,WarBananaReborn,in,,0,1,0,https://x.com/undefined/status/1992907449901502740,4811616558,,gadai ilegal penipuan berkedok tawaran kerja brushing scam skema ponzi multi level marketing mlm ilegal dll mereka juga melakukan pemblokiran ribuan situs web app nomor rekening nomor hp whatsapp penagih hingga menindak penagihan teror yang melanggar hukum,gadai ilegal penipuan berkedok tawaran kerja brushing scam skema ponzi multi level marketing mlm ilegal dll mereka juga melakukan pemblokiran ribuan situs web app nomor rekening nomor hp whatsapp penagih hingga menindak penagihan teror yang melanggar hukum,37,peluang_baru,True
1992868338603614517,Mon Nov 24 10:20:14 +0000 2025,0,@worksfess Aamiin ya allah dapet tawaran kerja dengan gaji yang aku harapkan aamiin,1992901061611602414,,worksfess,in,,0,0,0,https://x.com/undefined/status/1992901061611602414,955689295343378432,,aamiin ya allah dapet tawaran kerja dengan gaji yang aku harapkan aamiin,aamiin ya allah dapet tawaran kerja dengan gaji yang aku harapkan aamiin,13,peluang_baru,True
1992900333912338666,Mon Nov 24 10:17:20 +0000 2025,0,Ya Allah dapet tawaran kerja Roste 10:2. 10 minggu kerja 2 minggu libur https://t.co/o5pv8gP0OU,1992900333912338666,https://pbs.twimg.com/media/G6g0Sg1boAE89GI.jpg,,in,,0,0,0,https://x.com/undefined/status/1992900333912338666,1762767762110459904,,ya allah dapet tawaran kerja roste minggu kerja minggu libur,ya allah dapet tawaran kerja roste minggu kerja minggu libur,18,peluang_baru,True
1992877242574344379,Mon Nov 24 08:45:35 +0000 2025,8,Gue sampe stress dan mimpi yang malah dapet tawaran kerja adalah kucing gue karena setelah interviews dan submit design tests ya tetap dighosting,1992877242574344379,,,in,,0,1,1,https://x.com/undefined/status/1992877242574344379,1890230936601780224,,gue sampe stress dan mimpi yang malah dapet tawaran kerja adalah kucing gue karena setelah interviews dan submit design tests ya tetap dighosting,gue sampe stress dan mimpi yang malah dapet tawaran kerja adalah kucing gue karena setelah interviews dan submit design tests ya tetap dighosting,23,peluang_baru,True
1992484788578771305,Mon Nov 24 06:46:24 +0000 2025,0,@rambutan1970 @kumparan Dari perspektif komunikasi fenomena penipuan lowongan kerja di Indonesia melibatkan strategi persuasif canggih. Pelaku memanfaatkan saluran seperti SMS media sosial dan AI untuk membangun kepercayaan awal menggunakan bahasa emosional (misalnya tawaran kerja mudah) dan skema,1992847251102998989,,rambutan1970,in,,0,0,0,https://x.com/undefined/status/1992847251102998989,1720665183188922368,,dari perspektif komunikasi fenomena penipuan lowongan kerja di indonesia melibatkan strategi persuasif canggih pelaku memanfaatkan saluran seperti sms media sosial dan ai untuk membangun kepercayaan awal menggunakan bahasa emosional misalnya tawaran kerja mudah dan skema,dari perspektif komunikasi fenomena penipuan lowongan kerja di indonesia melibatkan strategi persuasif canggih pelaku memanfaatkan saluran seperti sms media sosial dan ai untuk membangun kepercayaan awal menggunakan bahasa emosional misalnya tawaran kerja mudah dan skema,37,peluang_baru,True
1992169542827876542,Mon Nov 24 06:26:32 +0000 2025,0,@rikisonofanjink Hai rikisonofanjink Anda dinasihati hadir ke kaunter KWSP untuk membuat aduan rasmi. Sila bawa bersama dokumen berikut: MyKad asal surat tawaran kerja Penyata Upah/Slip Gaji Bulanan dan Borang KWSP 1879 (muat turun di sini: https://t.co/FGxz4pnJr0) Terima kasih.,1992842251907584510,,rikisonofanjink,in,,0,1,0,https://x.com/undefined/status/1992842251907584510,99005079,,hai rikisonofanjink anda dinasihati hadir ke kaunter kwsp untuk membuat aduan rasmi sila bawa bersama dokumen berikut mykad asal surat tawaran kerja penyata upah slip gaji bulanan dan borang kwsp muat turun di sini terima kasih,hai rikisonofanjink anda dinasihati hadir ke kaunter kwsp untuk membuat aduan rasmi sila bawa bersama dokumen berikut mykad asal surat tawaran kerja penyata upah slip gaji bulanan dan borang kwsp muat turun di sini terima kasih,42,peluang_baru,True
1992828005862027395,Mon Nov 24 05:29:56 +0000 2025,0,abis dikasih tawaran kerja sm temen gajinya lumayan jd aku ambil. tp blm tau kpn mulai kerjanya,1992828005862027395,,,in,,0,1,0,https://x.com/undefined/status/1992828005862027395,1322036112731201536,,abis dikasih tawaran kerja sm temen gajinya lumayan jd aku ambil tp blm tau kpn mulai kerjanya,abis dikasih tawaran kerja sm temen gajinya lumayan jd aku ambil tp blm tau kpn mulai kerjanya,17,peluang_baru,True
1991875167879045288,Mon Nov 24 01:04:45 +0000 2025,0,@noneeexistent_ Hai noneeexistent_ Anda dinasihati hadir ke kaunter KWSP untuk membuat aduan rasmi. Sila bawa bersama dokumen berikut: MyKad asal surat tawaran kerja Penyata Upah/Slip Gaji Bulanan dan Borang KWSP 1879 (muat turun di sini: https://t.co/FGxz4pnJr0) Terima kasih.,1992761270513127752,,noneeexistent_,in,,0,1,0,https://x.com/undefined/status/1992761270513127752,99005079,,hai noneeexistent anda dinasihati hadir ke kaunter kwsp untuk membuat aduan rasmi sila bawa bersama dokumen berikut mykad asal surat tawaran kerja penyata upah slip gaji bulanan dan borang kwsp muat turun di sini terima kasih,hai noneeexistent anda dinasihati hadir ke kaunter kwsp untuk membuat aduan rasmi sila bawa bersama dokumen berikut mykad asal surat tawaran kerja penyata upah slip gaji bulanan dan borang kwsp muat turun di sini terima kasih,42,peluang_baru,True
1992529837064335837,Sun Nov 23 09:45:07 +0000 2025,29, aku dapet tawaran kerja di Denpasar gaji di atas UMR dikit. tapi aku rantau dari Jawa. kalo soal makan dll bisa lah dipress. aku juga bukan anak yg fomoan dan suka nongkrong. kira-kira masih aman nggak yaaa? ,1992529837064335837,,,in,,1,13,0,https://x.com/undefined/status/1992529837064335837,1331650559518990336,,aku dapet tawaran kerja di denpasar gaji di atas umr dikit tapi aku rantau dari jawa kalo soal makan dll bisa lah dipress aku juga bukan anak yg fomoan dan suka nongkrong kira kira masih aman nggak yaaa,aku dapet tawaran kerja di denpasar gaji di atas umr dikit tapi aku rantau dari jawa kalo soal makan dll bisa lah dipress aku juga bukan anak yg fomoan dan suka nongkrong kira kira masih aman nggak yaaa,38,peluang_baru,True
1992496708966617167,Sun Nov 23 07:33:28 +0000 2025,0,Lima weton ini diramal paling mudah dapat tawaran kerja pekan ini. Energi karier menguat peluang interview dan panggilan kerja terbuka! https://t.co/R03a5rikZj,1992496708966617167,,,in,,0,0,0,https://x.com/undefined/status/1992496708966617167,1404018642,,lima weton ini diramal paling mudah dapat tawaran kerja pekan ini energi karier menguat peluang interview dan panggilan kerja terbuka,lima weton ini diramal paling mudah dapat tawaran kerja pekan ini energi karier menguat peluang interview dan panggilan kerja terbuka,24,peluang_baru,True
1992493824007184623,Sun Nov 23 07:22:01 +0000 2025,2,Dpt tawaran kerja di jkt tpi aku ga punya siapa2 disana trus kalo mau nyari tmpt tinggal gimana brok,1992493824007184623,,,in,,0,6,0,https://x.com/undefined/status/1992493824007184623,1946823432622256128,,dpt tawaran kerja di jkt tpi aku ga punya siapa disana trus kalo mau nyari tmpt tinggal gimana brok,dpt tawaran kerja di jkt tpi aku ga punya siapa disana trus kalo mau nyari tmpt tinggal gimana brok,19,peluang_baru,True
1992154882812383460,Sun Nov 23 06:34:38 +0000 2025,0,@tanyakanrl Sorry to say nder jangan dengerin om lu emng 5 juta gaseberapa buat hidup di jkt tapi daripada 0 banget mending dijalani sambil cari pengalaman cari relasi ketika lu udh mulai krja org bisa liat value yg ada di diri lu otomatis tawaran kerja berikutnya akan mudah masuk,1992481899990958578,,tanyakanrl,in,,0,0,0,https://x.com/undefined/status/1992481899990958578,4307682019,,sorry to say nder jangan dengerin om lu emng juta gaseberapa buat hidup di jkt tapi daripada banget mending dijalani sambil cari pengalaman cari relasi ketika lu udh mulai krja org bisa liat value yg ada di diri lu otomatis tawaran kerja berikutnya akan mudah masuk,sorry to say nder jangan dengerin om lu emng juta gaseberapa buat hidup di jkt tapi daripada banget mending dijalani sambil cari pengalaman cari relasi ketika lu udh mulai krja org bisa liat value yg ada di diri lu otomatis tawaran kerja berikutnya akan mudah masuk,49,peluang_baru,True
1991831012817740247,Sun Nov 23 03:26:31 +0000 2025,0,@txtdrimedia Aku pak contohnya makannya seneng banget kalo dapet tawaran kerja freelance atau part time bisa buat nutupin,1992434558848139617,,txtdrimedia,in,,0,0,0,https://x.com/undefined/status/1992434558848139617,1533012740989628422,,aku pak contohnya makannya seneng banget kalo dapet tawaran kerja freelance atau part time bisa buat nutupin,aku pak contohnya makannya seneng banget kalo dapet tawaran kerja freelance atau part time bisa buat nutupin,18,peluang_baru,True
1992408124830236958,Sun Nov 23 01:41:28 +0000 2025,0,Udah paling benar mending berkarier dan stay di luar negeri aja deh. Jangan terima aja tawaran kerja didalam negeri (terutama BUMN) nanti dijebak.,1992408124830236958,,,in,,0,0,0,https://x.com/undefined/status/1992408124830236958,1526960808,,udah paling benar mending berkarier dan stay di luar negeri aja deh jangan terima aja tawaran kerja didalam negeri terutama bumn nanti dijebak,udah paling benar mending berkarier dan stay di luar negeri aja deh jangan terima aja tawaran kerja didalam negeri terutama bumn nanti dijebak,23,peluang_baru,True
1992348159549608413,Sat Nov 22 22:05:28 +0000 2025,0,Perusahaan gakan dapet karyawan yg loyal dengan memperlakukan hasil kerja mreka secara tidak profesional. Perusahaan hanya akan dapet karyawan yg ga profesional juga dan karyawan yg siap resign kapan saja ketika ada tawaran bkerja di prusahaan lain yg memberikan upah lbh tinggi,1992353766423822621,,cherie_deux,in,,0,0,0,https://x.com/undefined/status/1992353766423822621,352342562,,perusahaan gakan dapet karyawan yg loyal dengan memperlakukan hasil kerja mreka secara tidak profesional perusahaan hanya akan dapet karyawan yg ga profesional juga dan karyawan yg siap resign kapan saja ketika ada tawaran bkerja di prusahaan lain yg memberikan upah lbh tinggi,perusahaan gakan dapet karyawan yg loyal dengan memperlakukan hasil kerja mreka secara tidak profesional perusahaan hanya akan dapet karyawan yg ga profesional juga dan karyawan yg siap resign kapan saja ketika ada tawaran bkerja di prusahaan lain yg memberikan upah lbh tinggi,42,peluang_baru,True
1992285153557926067,Sat Nov 22 17:32:50 +0000 2025,0,Nolak tawaran kerja karena masih males buat kerja. Sekarang malah kek njir gua nganggur lama bgt,1992285153557926067,,,in,,0,0,0,https://x.com/undefined/status/1992285153557926067,1652704138520842241,,nolak tawaran kerja karena masih males buat kerja sekarang malah kek njir gua nganggur lama bgt,nolak tawaran kerja karena masih males buat kerja sekarang malah kek njir gua nganggur lama bgt,16,peluang_baru,True
1992238370278494610,Sat Nov 22 14:26:56 +0000 2025,0,SM bener2 anj! Pasti agensi ada andil jg utk nyuruh ke negara itu dan artisnya juga ngapain diterima tawaran kerja kayak gitu kalian kan bs nolak‍️,1992238370278494610,,,in,,0,0,0,https://x.com/undefined/status/1992238370278494610,1103088132,,sm bener anj pasti agensi ada andil jg utk nyuruh ke negara itu dan artisnya juga ngapain diterima tawaran kerja kayak gitu kalian kan bs nolak,sm bener anj pasti agensi ada andil jg utk nyuruh ke negara itu dan artisnya juga ngapain diterima tawaran kerja kayak gitu kalian kan bs nolak,26,peluang_baru,True
1992181817290732008,Sat Nov 22 10:42:12 +0000 2025,0,Daoet tawaran kerja di jkt tapi takut hoax padahal pengen,1992181817290732008,,,in,,0,0,0,https://x.com/undefined/status/1992181817290732008,1179622001528303616,,daoet tawaran kerja di jkt tapi takut hoax padahal pengen,daoet tawaran kerja di jkt tapi takut hoax padahal pengen,10,peluang_baru,True
1992166967877513254,Sat Nov 22 09:43:12 +0000 2025,0,People come and go (Mas rayhan dapet tawaran kerja di tempat lain),1992166967877513254,,,in,,0,0,0,https://x.com/undefined/status/1992166967877513254,1440318011055882244,,people come and go mas rayhan dapet tawaran kerja di tempat lain,people come and go mas rayhan dapet tawaran kerja di tempat lain,12,peluang_baru,True
1992165448113332553,Sat Nov 22 09:37:10 +0000 2025,0,Jangan percaya tawaran kerja online gaji besar . #UangHilang #JagaDataPribadi https://t.co/eGD61pHidy,1992165448113332553,https://pbs.twimg.com/media/G6WX6tjbYAEShxQ.jpg,,in,,0,0,0,https://x.com/undefined/status/1992165448113332553,1816351796572610563,,jangan percaya tawaran kerja online gaji besar,jangan percaya tawaran kerja online gaji besar,13,peluang_baru,True
1992127743862227369,Sat Nov 22 07:07:20 +0000 2025,80,duhh kutukan banyak tawaran kerja masuk pas udah offering letter lucu bgt dahhh,1992127743862227369,,,in,,2,10,8,https://x.com/undefined/status/1992127743862227369,105854145,,duhh kutukan banyak tawaran kerja masuk pas udah offering letter lucu bgt dahhh,duhh kutukan banyak tawaran kerja masuk pas udah offering letter lucu bgt dahhh,13,peluang_baru,True
