conversation_id_str,created_at,favorite_count,full_text,id_str,image_url,in_reply_to_screen_name,lang,location,quote_count,reply_count,retweet_count,tweet_url,user_id_str,username,text_clean_basic,text_stem,len_kata,kategori,is_turnover_related
1984163732982022551,Fri Oct 31 07:41:12 +0000 2025,0,Gini ya adulting yang satu ngingetin thesis satunya lagi job offer (super grateful for all my friends) &lt;3,1984163732982022551,,,in,,0,0,0,https://x.com/undefined/status/1984163732982022551,1736237922528174080,,gini ya adulting yang satu ngingetin thesis satunya lagi job offer super grateful for all my friends lt,gini ya adulting yang satu ngingetin thesis satunya lagi job offer super grateful for all my friends lt,19,peluang_baru,True
1983690350301430255,Thu Oct 30 11:06:53 +0000 2025,0,@worksfess Nepo baby sama urgently need itu beda ya sayang kamu nyogok jadi polisi bayar 2m nah itu Nepo baby. Beda dengan job position yg misal urgently need nah mereka butuh cepet buat gantiin posisi org yg resign tbtb jadi di offer by staff dulu biasanya ato kenalan yg terdekat,1983853105633779928,,worksfess,in,,0,0,0,https://x.com/undefined/status/1983853105633779928,1257927414312693760,,nepo baby sama urgently need itu beda ya sayang kamu nyogok jadi polisi bayar m nah itu nepo baby beda dengan job position yg misal urgently need nah mereka butuh cepet buat gantiin posisi org yg resign tbtb jadi di offer by staff dulu biasanya ato kenalan yg terdekat,nepo baby sama urgently need itu beda ya sayang kamu nyogok jadi polisi bayar m nah itu nepo baby beda dengan job position yg misal urgently need nah mereka butuh cepet buat gantiin posisi org yg resign tbtb jadi di offer by staff dulu biasanya ato kenalan yg terdekat,50,peluang_baru,True
1983733154176499947,Thu Oct 30 03:10:14 +0000 2025,1,Ada yg lewat di feeds dikatain skill issues dan liat job offer 20 jt untuk skilled person. hmmm itu gaji setara dgn gaji side job sy per minggu Meanwhile awal sy kerja saat SMA sktr thn 2018 role front end engineer remote US gaji start 4500 USD. Padahal sy masih blm skilled,1983733154176499947,,,in,,0,1,0,https://x.com/undefined/status/1983733154176499947,1680864025742311424,,ada yg lewat di feeds dikatain skill issues dan liat job offer jt untuk skilled person hmmm itu gaji setara dgn gaji side job sy per minggu meanwhile awal sy kerja saat sma sktr thn role front end engineer remote us gaji start usd padahal sy masih blm skilled,ada yg lewat di feeds dikatain skill issues dan liat job offer jt untuk skilled person hmmm itu gaji setara dgn gaji side job sy per minggu meanwhile awal sy kerja saat sma sktr thn role front end engineer remote us gaji start usd padahal sy masih blm skilled,52,peluang_baru,True
1983531431369560160,Wed Oct 29 13:48:40 +0000 2025,0,Pegi klinik untuk self check up eh alih alih dapat job offer ,1983531431369560160,,,in,,0,0,0,https://x.com/undefined/status/1983531431369560160,716345737353629696,,pegi klinik untuk self check up eh alih alih dapat job offer,pegi klinik untuk self check up eh alih alih dapat job offer,12,peluang_baru,True
1983506858372440427,Wed Oct 29 12:11:01 +0000 2025,0,Ana kont hamout 3la job offer awl ma galy msh bamshy lehh bgdd mn el ana feh da,1983506858372440427,,,in,,0,0,0,https://x.com/undefined/status/1983506858372440427,1233338776287621120,,ana kont hamout la job offer awl ma galy msh bamshy lehh bgdd mn el ana feh da,ana kont hamout la job offer awl ma galy msh bamshy lehh bgdd mn el ana feh da,18,peluang_baru,True
1983466714399719883,Wed Oct 29 10:37:42 +0000 2025,0,@ayman_abdull Best eh leak grwm pastu dapat job offer. Muka aku nampak miskin ke dorang nak offer job ni,1983483374439465217,,ayman_abdull,in,,0,0,0,https://x.com/undefined/status/1983483374439465217,1607633059,,best eh leak grwm pastu dapat job offer muka aku nampak miskin ke dorang nak offer job ni,best eh leak grwm pastu dapat job offer muka aku nampak miskin ke dorang nak offer job ni,20,peluang_baru,True
1983135748753690982,Wed Oct 29 00:25:23 +0000 2025,0,@meinmokhtar Lowball tu biasa la. Esp pada fresh graduate. Degree biasa. They know u desperate. Postpone saje kahwin tu. Dapatkan kerja yg stabil baru set date kahwin. Things in life ada aturan. Career stabil baru kahwin. Job offer reject saje. Cari lain.,1983329281829920775,,meinmokhtar,in,,0,0,0,https://x.com/undefined/status/1983329281829920775,1398486252102459393,,lowball tu biasa la esp pada fresh graduate degree biasa they know u desperate postpone saje kahwin tu dapatkan kerja yg stabil baru set date kahwin things in life ada aturan career stabil baru kahwin job offer reject saje cari lain,lowball tu biasa la esp pada fresh graduate degree biasa they know u desperate postpone saje kahwin tu dapatkan kerja yg stabil baru set date kahwin things in life ada aturan career stabil baru kahwin job offer reject saje cari lain,42,peluang_baru,True
1983135748753690982,Tue Oct 28 23:27:29 +0000 2025,0,@meinmokhtar Cari la krja dkt tp gaji jgn la demand sgt dulu. Bg dpt je dulu. X berbaloi nya smpai 1 jam plg cpt. Aku baru dpt 2 job offer smlm. Satu jarak 4.7km dr rmh. Lg satu 10km. Dua2 gaji sama. Tp sah2 aku pilih yg dkt. Kita ppuan xyah spend masa lama2 sgt ats jln. Lg2 yg dh nk kahwin》,1983314708158656608,,meinmokhtar,in,,0,1,0,https://x.com/undefined/status/1983314708158656608,130174047,,cari la krja dkt tp gaji jgn la demand sgt dulu bg dpt je dulu x berbaloi nya smpai jam plg cpt aku baru dpt job offer smlm satu jarak km dr rmh lg satu km dua gaji sama tp sah aku pilih yg dkt kita ppuan xyah spend masa lama sgt ats jln lg yg dh nk kahwin,cari la krja dkt tp gaji jgn la demand sgt dulu bg dpt je dulu x berbaloi nya smpai jam plg cpt aku baru dpt job offer smlm satu jarak km dr rmh lg satu km dua gaji sama tp sah aku pilih yg dkt kita ppuan xyah spend masa lama sgt ats jln lg yg dh nk kahwin,63,peluang_baru,True
1983206744164597780,Tue Oct 28 16:18:28 +0000 2025,5,weh i memang dah plan dari awal taknak cari hotel untuk tds nanti sebab i berharap i dah secured job kat kl before tds so nanti for concert i dah ada rumah sewa and I DID i finally get the job offer alhamdulillah ala kulli haal,1983206744164597780,,,in,,0,3,0,https://x.com/undefined/status/1983206744164597780,1069079255433138176,,weh i memang dah plan dari awal taknak cari hotel untuk tds nanti sebab i berharap i dah secured job kat kl before tds so nanti for concert i dah ada rumah sewa and i did i finally get the job offer alhamdulillah ala kulli haal,weh i memang dah plan dari awal taknak cari hotel untuk tds nanti sebab i berharap i dah secured job kat kl before tds so nanti for concert i dah ada rumah sewa and i did i finally get the job offer alhamdulillah ala kulli haal,46,peluang_baru,True
1983166736875827694,Tue Oct 28 13:39:30 +0000 2025,0,Wdym u sent someone to my house at 8:30 pm just because I wasn't returning ur call about ur shitty job offer??? Yg ada makin ga minat kerja disitu jir ud berasa dikejar kejar org krn ngutang,1983166736875827694,,,in,,0,1,0,https://x.com/undefined/status/1983166736875827694,1463039417610752001,,wdym u sent someone to my house at pm just because i wasn t returning ur call about ur shitty job offer yg ada makin ga minat kerja disitu jir ud berasa dikejar kejar org krn ngutang,wdym u sent someone to my house at pm just because i wasn t returning ur call about ur shitty job offer yg ada makin ga minat kerja disitu jir ud berasa dikejar kejar org krn ngutang,39,peluang_baru,True
1983159695172088158,Tue Oct 28 13:11:31 +0000 2025,111,it depends on the job offer itself. lu bisa bilang 90% applicants skill issue dan itu mungkin valid tapi gw juga bisa bilang 90% recruiter terlalu gatau diri dengan offer yg ga sebanding dengan orang yg dicari. terlalu naif dan nirempati kalau bilang demands wasn t the problem,1983159695172088158,,,in,,0,0,17,https://x.com/undefined/status/1983159695172088158,2253458677,,it depends on the job offer itself lu bisa bilang applicants skill issue dan itu mungkin valid tapi gw juga bisa bilang recruiter terlalu gatau diri dengan offer yg ga sebanding dengan orang yg dicari terlalu naif dan nirempati kalau bilang demands wasn t the problem,it depends on the job offer itself lu bisa bilang applicants skill issue dan itu mungkin valid tapi gw juga bisa bilang recruiter terlalu gatau diri dengan offer yg ga sebanding dengan orang yg dicari terlalu naif dan nirempati kalau bilang demands wasn t the problem,48,peluang_baru,True
1983120035167256596,Tue Oct 28 10:33:55 +0000 2025,0,Ye Tanya Mittal ka Staff jo khd Job pe hain... Mrko Job offer kar rhaaa hain and mne bola kii dilaa do toh bss uske baad se Gayab hainn #TanyaMittal #BigBoss19 #BB19 #FarrhanaBhatt https://t.co/86nkLWy6Gu,1983120035167256596,https://pbs.twimg.com/media/G4V1KZQXIAAm8nh.jpg,,in,,0,0,0,https://x.com/undefined/status/1983120035167256596,1910633151606476800,,ye tanya mittal ka staff jo khd job pe hain mrko job offer kar rhaaa hain and mne bola kii dilaa do toh bss uske baad se gayab hainn,ye tanya mittal ka staff jo khd job pe hain mrko job offer kar rhaaa hain and mne bola kii dilaa do toh bss uske baad se gayab hainn,37,peluang_baru,True
1982048813788577950,Sat Oct 25 11:39:29 +0000 2025,0,Oh ya terus... abis ketolak job offer malah ditawarin job sama dosen sendiri.... unexpected indeed.,1982049370918035834,,iwauizumi,in,,0,0,0,https://x.com/undefined/status/1982049370918035834,1367355037790302208,,oh ya terus abis ketolak job offer malah ditawarin job sama dosen sendiri unexpected indeed,oh ya terus abis ketolak job offer malah ditawarin job sama dosen sendiri unexpected indeed,15,peluang_baru,True
1981905152501321902,Sat Oct 25 10:00:18 +0000 2025,1,@aakancvedi @ittzz_rahul tumko bhi harvard sey job offer ayega inshallah,1982024412204569051,,aakancvedi,in,,0,1,0,https://x.com/undefined/status/1982024412204569051,1431523768837427200,,tumko bhi harvard sey job offer ayega inshallah,tumko bhi harvard sey job offer ayega inshallah,11,peluang_baru,True
1981947428401234333,Sat Oct 25 08:34:59 +0000 2025,0,@priyanka2bharti Hahaha he deserves to be unemployed. Kisi bhi IT company mei max notice period 3 month ka hota hai and IT companies mei koi bhi bina offer letter ka resign nhi karta. Agar ye bewakuf bina job k resign kark baitha hai then ye ya to feku hai ya ye bahot bada wala murkh ,1982002942350868909,,priyanka2bharti,in,,0,1,0,https://x.com/undefined/status/1982002942350868909,4610972000,,hahaha he deserves to be unemployed kisi bhi it company mei max notice period month ka hota hai and it companies mei koi bhi bina offer letter ka resign nhi karta agar ye bewakuf bina job k resign kark baitha hai then ye ya to feku hai ya ye bahot bada wala murkh,hahaha he deserves to be unemployed kisi bhi it company mei max notice period month ka hota hai and it companies mei koi bhi bina offer letter ka resign nhi karta agar ye bewakuf bina job k resign kark baitha hai then ye ya to feku hai ya ye bahot bada wala murkh,55,peluang_baru,True
1981860242184192011,Fri Oct 24 23:07:57 +0000 2025,5,ChiaSoh ni diibaratkan anak no.2 Bila semua2 gagal maka merekalah yg offer diri untuk maju ke depan. But bila dia rasa nanti ada yg lain tolong maju smpai ke SF dia pun berhenti di tmpt yg dia suka. Good Job ChiaSoh #FranceOpen2025,1981860242184192011,,,in,,0,0,0,https://x.com/undefined/status/1981860242184192011,806033126115852292,,chiasoh ni diibaratkan anak no bila semua gagal maka merekalah yg offer diri untuk maju ke depan but bila dia rasa nanti ada yg lain tolong maju smpai ke sf dia pun berhenti di tmpt yg dia suka good job chiasoh,chiasoh ni diibaratkan anak no bila semua gagal maka merekalah yg offer diri untuk maju ke depan but bila dia rasa nanti ada yg lain tolong maju smpai ke sf dia pun berhenti di tmpt yg dia suka good job chiasoh,43,peluang_baru,True
1981561325290676294,Fri Oct 24 08:08:14 +0000 2025,0,@bIushmy Semoga doa-doa baik di sini terjabah kak aamiin kakaknya segera diberikan job offer dan semakin dilancarkan rezekinya dalam usahanya aamiin. Semangat kak ,1981633819037020632,,bIushmy,in,,0,0,0,https://x.com/undefined/status/1981633819037020632,1858774411593347074,,semoga doa doa baik di sini terjabah kak aamiin kakaknya segera diberikan job offer dan semakin dilancarkan rezekinya dalam usahanya aamiin semangat kak,semoga doa doa baik di sini terjabah kak aamiin kakaknya segera diberikan job offer dan semakin dilancarkan rezekinya dalam usahanya aamiin semangat kak,24,peluang_baru,True
1981187168879202701,Thu Oct 23 02:33:26 +0000 2025,18,Kepada yang tengah diberi job offer baca ni dulu tau https://t.co/GAaziRyfVR,1981187176315703539,,faridaffy,in,,0,1,6,https://x.com/undefined/status/1981187176315703539,41559594,,kepada yang tengah diberi job offer baca ni dulu tau,kepada yang tengah diberi job offer baca ni dulu tau,14,peluang_baru,True
1980919616718450951,Thu Oct 23 02:13:11 +0000 2025,3,@ariazusa Kok bisa langsung judging ga baca job offer ini??? Gmn klo job desc-nya dibuat se- elegan mungkin jd ga ketauan klo itu scam?!! Dan ga semua orang tau mana job offer yg scam mana yg ga. Apalagi tawaran ke luar negeri?? Siapa yg ngga mau coba in this economy???,1981182083528872281,,ariazusa,in,,0,0,0,https://x.com/undefined/status/1981182083528872281,1294130448113627137,,kok bisa langsung judging ga baca job offer ini gmn klo job desc nya dibuat se elegan mungkin jd ga ketauan klo itu scam dan ga semua orang tau mana job offer yg scam mana yg ga apalagi tawaran ke luar negeri siapa yg ngga mau coba in this economy,kok bisa langsung judging ga baca job offer ini gmn klo job desc nya dibuat se elegan mungkin jd ga ketauan klo itu scam dan ga semua orang tau mana job offer yg scam mana yg ga apalagi tawaran ke luar negeri siapa yg ngga mau coba in this economy,51,peluang_baru,True
1980251400656613388,Wed Oct 22 08:53:23 +0000 2025,0,@anakgawang28_ ini bisa ditawarin resto malaysia dari temen deket atau job offer online? kalau dari temen bisa ditracking tuh brokernya,1980920406367502575,,anakgawang28_,in,,0,0,0,https://x.com/undefined/status/1980920406367502575,1000207072032522241,,ini bisa ditawarin resto malaysia dari temen deket atau job offer online kalau dari temen bisa ditracking tuh brokernya,ini bisa ditawarin resto malaysia dari temen deket atau job offer online kalau dari temen bisa ditracking tuh brokernya,20,peluang_baru,True
1980919616718450951,Wed Oct 22 08:50:14 +0000 2025,338,sebel bgt di qrt masih ada yg nyalahin ga baca job offer secara detail atau ngomong masih ada yg ketipu ginian sadar ga sih ga semua orang chronically online dan sumber utama masalah ini tuh dari kemiskinan sama minimnya perlindungan dari pemerintah,1980919616718450951,,,in,,3,5,79,https://x.com/undefined/status/1980919616718450951,1709615150314237952,,sebel bgt di qrt masih ada yg nyalahin ga baca job offer secara detail atau ngomong masih ada yg ketipu ginian sadar ga sih ga semua orang chronically online dan sumber utama masalah ini tuh dari kemiskinan sama minimnya perlindungan dari pemerintah,sebel bgt di qrt masih ada yg nyalahin ga baca job offer secara detail atau ngomong masih ada yg ketipu ginian sadar ga sih ga semua orang chronically online dan sumber utama masalah ini tuh dari kemiskinan sama minimnya perlindungan dari pemerintah,42,peluang_baru,True
1980543749521539528,Wed Oct 22 05:06:21 +0000 2025,0,@AmirulAbu baru iv.. belum job offer bang ,1980863271143145559,,AmirulAbu,in,,0,0,0,https://x.com/undefined/status/1980863271143145559,1676854053748506625,,baru iv belum job offer bang,baru iv belum job offer bang,7,peluang_baru,True
1980818006591918346,Wed Oct 22 02:06:29 +0000 2025,0,gue ga ambil job offer sama jobdesk magang yg satu itu masalahnye gue bolos mulu jadinya kan gue mau naikin ips gue semester ini ,1980818006591918346,,,in,,0,1,0,https://x.com/undefined/status/1980818006591918346,1564626024247459843,,gue ga ambil job offer sama jobdesk magang yg satu itu masalahnye gue bolos mulu jadinya kan gue mau naikin ips gue semester ini,gue ga ambil job offer sama jobdesk magang yg satu itu masalahnye gue bolos mulu jadinya kan gue mau naikin ips gue semester ini,24,peluang_baru,True
1980558103080046691,Tue Oct 21 08:53:43 +0000 2025,1,Alhamdulillah rezeki Allah nk bg. Dpt job offer baru. Ok boleh plan next year nk benti mengajar tuisyen nk fokus dkt ziqri. Ada rezeki nk cari bapak baru utk ziqri ,1980558103080046691,,,in,,0,0,0,https://x.com/undefined/status/1980558103080046691,267508280,,alhamdulillah rezeki allah nk bg dpt job offer baru ok boleh plan next year nk benti mengajar tuisyen nk fokus dkt ziqri ada rezeki nk cari bapak baru utk ziqri,alhamdulillah rezeki allah nk bg dpt job offer baru ok boleh plan next year nk benti mengajar tuisyen nk fokus dkt ziqri ada rezeki nk cari bapak baru utk ziqri,30,peluang_baru,True
1980111049119645783,Mon Oct 20 03:20:26 +0000 2025,0,Kerjasama BUKAN BERARTI aku gak terima sama sekali. I still accept job offer to attend an event (visit) PR (hanya di upload untuk brand &amp; product awareness) narasumber and something else as long bukan untuk kewajiban mereview/konten khusus.,1980111843776709018,,hi__itsnat,in,,0,1,0,https://x.com/undefined/status/1980111843776709018,1315868143961608192,,kerjasama bukan berarti aku gak terima sama sekali i still accept job offer to attend an event visit pr hanya di upload untuk brand amp product awareness narasumber and something else as long bukan untuk kewajiban mereview konten khusus,kerjasama bukan berarti aku gak terima sama sekali i still accept job offer to attend an event visit pr hanya di upload untuk brand amp product awareness narasumber and something else as long bukan untuk kewajiban mereview konten khusus,39,peluang_baru,True
1979838467707449404,Sun Oct 19 10:27:16 +0000 2025,0,@dubujjiggae Aku denger2 krn writernim nya dpt job offer yg lebih bagus by. Ga mengenalisir tp kerja ama orang cina dan india itu beneran bikin mental down ,1979856871679983616,,dubujjiggae,in,,0,1,0,https://x.com/undefined/status/1979856871679983616,1109786960967565314,,aku denger krn writernim nya dpt job offer yg lebih bagus by ga mengenalisir tp kerja ama orang cina dan india itu beneran bikin mental down,aku denger krn writernim nya dpt job offer yg lebih bagus by ga mengenalisir tp kerja ama orang cina dan india itu beneran bikin mental down,27,peluang_baru,True
1979650449633649148,Sun Oct 19 05:38:56 +0000 2025,2,@Ingabirehalima1 Job offer yahawe cg acuruza iki https://t.co/GpVWJ8eHph,1979784310644461851,https://pbs.twimg.com/media/G3mbTRfWgAAbD1p.jpg,Ingabirehalima1,in,,0,0,0,https://x.com/undefined/status/1979784310644461851,1560625548690305024,,job offer yahawe cg acuruza iki,job offer yahawe cg acuruza iki,11,peluang_baru,True
1979589949994459409,Sat Oct 18 16:47:31 +0000 2025,0,@centauxri AKU LAGI BIKIN JOB OFFER LETTER.,1979590176335872246,,centauxri,in,,0,1,0,https://x.com/undefined/status/1979590176335872246,2228344832,,aku lagi bikin job offer letter,aku lagi bikin job offer letter,7,peluang_baru,True
1979489711262740560,Sat Oct 18 16:22:56 +0000 2025,0,@iRaiSaqib To PTV m hi unko q job krni hai. Itni parhi likhi professional hain woh to koi bhi idara unko job offer kre ga. 5 lakh to bohat kam hai woh millions m earn kr skti hain.,1979583990060175504,,iRaiSaqib,in,,0,0,0,https://x.com/undefined/status/1979583990060175504,1143796183552397317,,to ptv m hi unko q job krni hai itni parhi likhi professional hain woh to koi bhi idara unko job offer kre ga lakh to bohat kam hai woh millions m earn kr skti hain,to ptv m hi unko q job krni hai itni parhi likhi professional hain woh to koi bhi idara unko job offer kre ga lakh to bohat kam hai woh millions m earn kr skti hain,38,peluang_baru,True
1979392164305211826,Sat Oct 18 03:40:41 +0000 2025,0,Dapat job offer kat penang tktau nk pergi ke tak,1979392164305211826,,,in,,0,1,0,https://x.com/undefined/status/1979392164305211826,1010845317669851137,,dapat job offer kat penang tktau nk pergi ke tak,dapat job offer kat penang tktau nk pergi ke tak,10,peluang_baru,True
1979148283399360740,Fri Oct 17 11:31:36 +0000 2025,0,ya Allah dirumah banyak ngebatinnya malah bikin tambah stres mau nangis juga gabisa karena gapernah ada waktu untuk sendiri.. tolong give me a job offer ya Allah..,1979148283399360740,,,in,,0,0,0,https://x.com/undefined/status/1979148283399360740,1729686536688705536,,ya allah dirumah banyak ngebatinnya malah bikin tambah stres mau nangis juga gabisa karena gapernah ada waktu untuk sendiri tolong give me a job offer ya allah,ya allah dirumah banyak ngebatinnya malah bikin tambah stres mau nangis juga gabisa karena gapernah ada waktu untuk sendiri tolong give me a job offer ya allah,27,peluang_baru,True
1978837131666584000,Thu Oct 16 14:55:11 +0000 2025,1,Tempat aku buat locum dulu turun rate dia what the hell nasib baik tak amek job offer ni dulu,1978837131666584000,,,in,,0,0,0,https://x.com/undefined/status/1978837131666584000,84475982,,tempat aku buat locum dulu turun rate dia what the hell nasib baik tak amek job offer ni dulu,tempat aku buat locum dulu turun rate dia what the hell nasib baik tak amek job offer ni dulu,19,peluang_baru,True
1978353934537216306,Wed Oct 15 08:05:23 +0000 2025,1,@worksfess Gapapa banget nder. Kalau setelah dihitung-hitung malah tekor di biaya hidup wajar buat gak dilanjut. Jangan sampe kamu cape kerja tapi gak bisa nabung atau bahkan nombok tiap bulan. Semoga ada job offer yang lebih baik yaa!,1978371613788697033,,worksfess,in,,0,0,0,https://x.com/undefined/status/1978371613788697033,112674312,,gapapa banget nder kalau setelah dihitung hitung malah tekor di biaya hidup wajar buat gak dilanjut jangan sampe kamu cape kerja tapi gak bisa nabung atau bahkan nombok tiap bulan semoga ada job offer yang lebih baik yaa,gapapa banget nder kalau setelah dihitung hitung malah tekor di biaya hidup wajar buat gak dilanjut jangan sampe kamu cape kerja tapi gak bisa nabung atau bahkan nombok tiap bulan semoga ada job offer yang lebih baik yaa,39,peluang_baru,True
1978108795810115783,Tue Oct 14 14:41:52 +0000 2025,0,semoga diganti yang lebih baik (job offer),1978109004111884578,,cinetaes,in,,0,0,0,https://x.com/undefined/status/1978109004111884578,1871172080395579392,,semoga diganti yang lebih baik job offer,semoga diganti yang lebih baik job offer,7,peluang_baru,True
1978108354019873050,Tue Oct 14 14:40:03 +0000 2025,0,@easyZ4scy Hai! Untuk bekerja di Jepang syarat umumnya meliputi: 1. Visa kerja (seperti Tokutei Ginou): Butuh job offer dan Certificate of Eligibility (COE). 2. Usia minimal 18 tahun sehat jasmani/rohani (tes TBC dll.). 3. Kemampuan bahasa Jepang (JLPT N4/N5 atau setara). 4. Lulus ujian,1978108547360805282,,easyZ4scy,in,,0,0,0,https://x.com/undefined/status/1978108547360805282,1720665183188922368,,hai untuk bekerja di jepang syarat umumnya meliputi visa kerja seperti tokutei ginou butuh job offer dan certificate of eligibility coe usia minimal tahun sehat jasmani rohani tes tbc dll kemampuan bahasa jepang jlpt n n atau setara lulus ujian,hai untuk bekerja di jepang syarat umumnya meliputi visa kerja seperti tokutei ginou butuh job offer dan certificate of eligibility coe usia minimal tahun sehat jasmani rohani tes tbc dll kemampuan bahasa jepang jlpt n n atau setara lulus ujian,46,peluang_baru,True
1978035491464192032,Tue Oct 14 09:49:45 +0000 2025,0,alhamdulillah banyak job offer pastu rn aku pula confuse nak pilih mana,1978035491464192032,,,in,,0,0,0,https://x.com/undefined/status/1978035491464192032,1273870260,,alhamdulillah banyak job offer pastu rn aku pula confuse nak pilih mana,alhamdulillah banyak job offer pastu rn aku pula confuse nak pilih mana,12,peluang_baru,True
1976105914089476397,Thu Oct 09 02:02:18 +0000 2025,0,Ada job offer ke? Boleh dm,1976105914089476397,,,in,,0,0,0,https://x.com/undefined/status/1976105914089476397,1851296392108797952,,ada job offer ke boleh dm,ada job offer ke boleh dm,6,peluang_baru,True
1975634040050098643,Wed Oct 08 11:11:09 +0000 2025,0,@TejashwiYdvRJD Bhai ye oh ye kehta hun ye itna he layak h Bihar k liye toh isko bolo ek MNC company m interview dekar job offer letter dekar dikhaye isko koi apni company m chaprasi nahi rakhega,1975881647976583677,,TejashwiYdvRJD,in,,0,0,0,https://x.com/undefined/status/1975881647976583677,1933729968330092544,,bhai ye oh ye kehta hun ye itna he layak h bihar k liye toh isko bolo ek mnc company m interview dekar job offer letter dekar dikhaye isko koi apni company m chaprasi nahi rakhega,bhai ye oh ye kehta hun ye itna he layak h bihar k liye toh isko bolo ek mnc company m interview dekar job offer letter dekar dikhaye isko koi apni company m chaprasi nahi rakhega,37,peluang_baru,True
1975188632366620867,Tue Oct 07 10:18:06 +0000 2025,1,@NidaRwanda ESE bugenda bite kugirango Umuntu atsindire ikizamini Cyakazi akaba job offer Nyuma mukamukura kumazi mwamuhaye nta nteguza @NidaRwanda gusa byagaragaje Imikoranire hagati yanyu kuntu iteye. Gusa sibyiza kbs mwakabaye Nwarabateguje abo nwakimye mbere kugirango buyakire.,1975505907879489637,,NidaRwanda,in,,0,3,0,https://x.com/undefined/status/1975505907879489637,1666012040899469312,,ese bugenda bite kugirango umuntu atsindire ikizamini cyakazi akaba job offer nyuma mukamukura kumazi mwamuhaye nta nteguza gusa byagaragaje imikoranire hagati yanyu kuntu iteye gusa sibyiza kbs mwakabaye nwarabateguje abo nwakimye mbere kugirango buyakire,ese bugenda bite kugirango umuntu atsindire ikizamini cyakazi akaba job offer nyuma mukamukura kumazi mwamuhaye nta nteguza gusa byagaragaje imikoranire hagati yanyu kuntu iteye gusa sibyiza kbs mwakabaye nwarabateguje abo nwakimye mbere kugirango buyakire,36,peluang_baru,True
1975231513454408163,Mon Oct 06 16:07:45 +0000 2025,0,2 kali dapet job offer dari linkedin tapi kenapa selalu ga cocok ya ,1975231513454408163,,,in,,0,0,0,https://x.com/undefined/status/1975231513454408163,1268381318179467265,,kali dapet job offer dari linkedin tapi kenapa selalu ga cocok ya,kali dapet job offer dari linkedin tapi kenapa selalu ga cocok ya,13,peluang_baru,True
